{
  "total_duration_sec": 30,
  "bgm_track": "",
  "bgm_duck_points": [
    {
      "start_sec": 19.5,
      "end_sec": 25.5,
      "ratio": 0.3
    }
  ],
  "scenes": [
    {
      "id": 1,
      "start_sec": 0.0,
      "end_sec": 2.4,
      "zoom": false,
      "transition_out": "smash-cut",
      "bgm": {
        "cue": "fade_in"
      },
      "subtitle_timing": [
        {
          "text": "트러블 때문에",
          "start_ms": 0,
          "end_ms": 600,
          "emphasis": false
        },
        {
          "text": "맨날 쿨링패드만",
          "start_ms": 600,
          "end_ms": 1200,
          "emphasis": false
        },
        {
          "text": "붙이고 있는",
          "start_ms": 1200,
          "end_ms": 1800,
          "emphasis": false
        },
        {
          "text": "girly 있어?",
          "start_ms": 1800,
          "end_ms": 2400,
          "emphasis": true
        }
      ]
    },
    {
      "id": 2,
      "start_sec": 2.4,
      "end_sec": 8.4,
      "zoom": false,
      "transition_out": "cut",
      "bgm": {
        "cue": "continue"
      },
      "subtitle_timing": [
        {
          "text": "나도 작년에 턱선 트러블이",
          "start_ms": 0,
          "end_ms": 2000,
          "emphasis": false
        },
        {
          "text": "너무 심해서 외출도 못했거든.",
          "start_ms": 2000,
          "end_ms": 4000,
          "emphasis": false
        },
        {
          "text": "진짜 자신감 바닥이었어",
          "start_ms": 4000,
          "end_ms": 6000,
          "emphasis": false
        }
      ]
    },
    {
      "id": 3,
      "start_sec": 8.4,
      "end_sec": 19.5,
      "zoom": true,
      "transition_out": "cut",
      "bgm": {
        "cue": "energy_up"
      },
      "subtitle_timing": [
        {
          "text": "그래서 찾은",
          "start_ms": 0,
          "end_ms": 1233,
          "emphasis": false
        },
        {
          "text": "진정 루틴",
          "start_ms": 1233,
          "end_ms": 2466,
          "emphasis": false
        },
        {
          "text": "3단계. 첫째",
          "start_ms": 2466,
          "end_ms": 3699,
          "emphasis": true
        },
        {
          "text": "저자극 클렌징오일로",
          "start_ms": 3699,
          "end_ms": 4932,
          "emphasis": false
        },
        {
          "text": "메이크업 지우고.",
          "start_ms": 4932,
          "end_ms": 6165,
          "emphasis": false
        },
        {
          "text": "둘째 시카",
          "start_ms": 6165,
          "end_ms": 7398,
          "emphasis": false
        },
        {
          "text": "토너 듬뿍.",
          "start_ms": 7398,
          "end_ms": 8631,
          "emphasis": false
        },
        {
          "text": "셋째 무향",
          "start_ms": 8631,
          "end_ms": 9864,
          "emphasis": false
        },
        {
          "text": "수분크림으로 마무리",
          "start_ms": 9864,
          "end_ms": 11097,
          "emphasis": false
        }
      ]
    },
    {
      "id": 4,
      "start_sec": 19.5,
      "end_sec": 25.5,
      "zoom": false,
      "transition_out": "cut",
      "bgm": {
        "cue": "duck"
      },
      "subtitle_timing": [
        {
          "text": "요즘 내가 쓰는 거",
          "start_ms": 0,
          "end_ms": 1500,
          "emphasis": false
        },
        {
          "text": "이거야. 피부 진정에 진짜",
          "start_ms": 1500,
          "end_ms": 3000,
          "emphasis": false
        },
        {
          "text": "미쳤음. 향도 없고 자극도",
          "start_ms": 3000,
          "end_ms": 4500,
          "emphasis": false
        },
        {
          "text": "제로",
          "start_ms": 4500,
          "end_ms": 6000,
          "emphasis": false
        }
      ]
    },
    {
      "id": 5,
      "start_sec": 25.5,
      "end_sec": 30.0,
      "zoom": false,
      "transition_out": "fade",
      "bgm": {
        "cue": "fade_out"
      },
      "subtitle_timing": [
        {
          "text": "도움됐으면 저장해두고",
          "start_ms": 0,
          "end_ms": 1500,
          "emphasis": false
        },
        {
          "text": "팔로우도 부탁해요",
          "start_ms": 1500,
          "end_ms": 3000,
          "emphasis": false
        },
        {
          "text": "girly들",
          "start_ms": 3000,
          "end_ms": 4500,
          "emphasis": false
        }
      ]
    }
  ]
}